{
  "type": "forgero:composite_model",
  "id": "minecraft:item/diamond_pickaxe",
  "target": "minecraft:diamond-pickaxe",
  "layers": [
    {
      "order": 10,
      "textures": {
        "default": "minecraft:item/diamond_pickaxe"
      }
    }
  ],
  "mount_points": [
    {
      "name": "binding",
      "position": [ 11, 10 ]
    },
    {
      "name": "grip",
      "position": [ 6, 5 ]
    },
    {
      "name": "tip",
      "position": [ 12, 12 ]
    }
  ],
  "slots": [
    {
      "id": "binding_slot",
      "order": 25,
      "mount": "binding",
      "renderer": {
        "type": "forgero:component",
        "context": "tool_binding"
      }
    },
    {
      "id": "handle_grip_slot",
      "order": 20,
      "mount": "grip",
      "renderer": {
        "type": "forgero:component",
        "context": "handle_grip"
      }
    },
    {
      "id": "tip_reinforcement_slot",
      "order": 25,
      "mount": "tip",
      "child_mount": "attachment_point",
      "renderer": {
        "type": "forgero:component",
        "context": "pickaxe_head_reinforcement"
      }
    }
  ]
}
